<!-- DTD-Definition Vineta V3.0 (und aelter) -->

<!ENTITY % Boolean "(ja|nein)">
<!ENTITY % Digit "(0|1|2|3|4|5|6)">
<!ENTITY % FORMATE "(#PCDATA|F|K|U)*">
<!ENTITY % FORMATENZ "(#PCDATA|F|K|U)*">
<!ENTITY % FORMATELN "(#PCDATA|F|K|U|N|L)*">
<!ENTITY % Text "(A)*">

<!-- Formatierungen -->
<!ELEMENT F 	%FORMATE;>	<!-- Fett 		-->
<!ELEMENT K 	%FORMATE;>	<!-- Kursiv 		-->
<!ELEMENT U 	%FORMATE;>  	<!-- Unterstrichen 	-->
<!ELEMENT A	%FORMATENZ;>	<!-- Absatz 		-->
<!ELEMENT L	%FORMATENZ;>	<!-- Liste 		-->

<!-- Zutaten, Zubehoer -->
<!ELEMENT Zutat		%FORMATELN;>
<!ELEMENT Zubehoer	%FORMATELN;>
<!ELEMENT Dekoration	%FORMATELN;>
<!ELEMENT Zutaten (Zutat)+>
<!ELEMENT Zubehoere (Zubehoer)+>
<!ELEMENT Dekorationen (Dekoration)+>
<!ELEMENT BildId (#PCDATA)>

<!-- Cocktail/Rezept -->
<!ELEMENT Name		%FORMATE;>
<!ELEMENT Geschmack	%FORMATE;>
<!ELEMENT Rubrik	%FORMATE;>
<!ELEMENT Wertung       (#PCDATA)> <!-- wg. Kompatibiltaet zu Vineta 1.0, 1.2 -->
<!ELEMENT Anleitung	%Text;>
<!ELEMENT Bemerkung	%Text;>
<!ELEMENT Text		%Text;>

<!-- Um mit den Dateien von Vineta 1.0 and 1.2 kompatibel zu sein,
     sind hier zwei Varianten notwendig: -->
<!ENTITY % BasisEintrag "((Rubrik?, Name) | (Name, Rubrik?))">

<!ENTITY % NurText "(%BasisEintrag;, Text?)">

<!-- Um mit den Datein von Vineta 1.0 and 1.2 kompatibel zu sein,
     benoetigen wir das Element Cocktail: -->
<!ELEMENT Cocktail (%BasisEintrag;, Geschmack?, Wertung?, Zutaten?, Zubehoere?, Dekorationen?, Anleitung?, Bemerkung?)>
  <!ATTLIST Cocktail alkoholhaltig %Boolean; #REQUIRED>

<!ELEMENT Rezept (%BasisEintrag;, Geschmack?, Zutaten?, Zubehoere?, Dekorationen?, Anleitung?, Bemerkung?, BildId?)>
  <!ATTLIST Rezept alkoholhaltig %Boolean; #IMPLIED>
  <!ATTLIST Rezept Wertung %Digit; #IMPLIED>
<!ELEMENT Tip %NurText;>
<!ELEMENT Information %NurText;>

<!-- Um mit den Datein von Vineta 1.0 and 1.2 kompatibel zu sein,
     benoetigen wir das Root-Element Cocktails: -->
<!ELEMENT Cocktails (Cocktail|Tip|Information)*>

<!-- Rezept-Liste (Root) -->
<!ELEMENT Rezepte (Rezept|Tip|Information)*>

<!-- Der Rest der Datei ist fuer die Kompatibiltaet zu Vineta 1.0 and 1.2 Dateien,
     die noch in ISO-8859-1 gespeichert sind -->
<!-- Sonderzeichen -->
<!ENTITY nbsp	"&#160;">
<!ENTITY iexcl	"&#161;">
<!ENTITY cent	"&#162;">
<!ENTITY pound	"&#163;">
<!ENTITY curren	"&#164;">
<!ENTITY yen	"&#165;">
<!ENTITY brvbar	"&#166;">
<!ENTITY sect	"&#167;">
<!ENTITY uml	"&#168;">
<!ENTITY copy	"&#169;">
<!ENTITY ordf	"&#170;">
<!ENTITY laquo	"&#171;">
<!ENTITY not	"&#172;">
<!ENTITY shy	"&#173;">
<!ENTITY reg	"&#174;">
<!ENTITY macr	"&#175;">
<!ENTITY deg	"&#176;">
<!ENTITY plusmn	"&#177;">
<!ENTITY sup2	"&#178;">
<!ENTITY sup3	"&#179;">
<!ENTITY acute	"&#180;">
<!ENTITY micro	"&#181;">
<!ENTITY para	"&#182;">
<!ENTITY middot	"&#183;">
<!ENTITY cedil	"&#184;">
<!ENTITY sup1	"&#185;">
<!ENTITY ordm	"&#186;">
<!ENTITY raquo	"&#187;">
<!ENTITY frac14	"&#188;">
<!ENTITY frac12	"&#189;">
<!ENTITY frac34	"&#190;">
<!ENTITY iquest	"&#191;">

<!-- sprachspezifische Zeichen gross -->
<!ENTITY Agrave	"&#192;">
<!ENTITY Aacute	"&#193;">
<!ENTITY Acirc	"&#194;">
<!ENTITY Atilde	"&#195;">
<!ENTITY Auml 	"&#196;">
<!ENTITY Aring	"&#197;">
<!ENTITY AElig	"&#198;">

<!ENTITY Cedil 	"&#199;">

<!ENTITY Egrave	"&#200;">
<!ENTITY Eacute	"&#201;">
<!ENTITY Ecirc	"&#202;">
<!ENTITY Euml 	"&#203;">

<!ENTITY Igrave	"&#204;">
<!ENTITY Iacute	"&#205;">
<!ENTITY Icirc	"&#206;">
<!ENTITY Iuml 	"&#207;">

<!ENTITY ETH 	"&#208;">

<!ENTITY Ntilde	"&#209;">

<!ENTITY Ograve	"&#210;">
<!ENTITY Oacute	"&#211;">
<!ENTITY Ocirc	"&#212;">
<!ENTITY Otilde	"&#213;">
<!ENTITY Ouml 	"&#214;">

<!ENTITY times 	"&#215;">

<!ENTITY Oslash	"&#216;">

<!ENTITY Ugrave	"&#217;">
<!ENTITY Uacute	"&#218;">
<!ENTITY Ucirc	"&#219;">
<!ENTITY Uuml 	"&#220;">

<!ENTITY Yacute	"&#221;">

<!ENTITY THORN	"&#222;">

<!-- sprachspezifische Zeichen klein -->
<!ENTITY szlig 	"&#223;">

<!ENTITY agrave	"&#224;">
<!ENTITY aacute	"&#225;">
<!ENTITY acirc 	"&#226;">
<!ENTITY azilde	"&#227;">
<!ENTITY auml 	"&#228;">
<!ENTITY aring 	"&#229;">
<!ENTITY aelig 	"&#230;">

<!ENTITY ccedil	"&#231;">

<!ENTITY egrave	"&#232;">
<!ENTITY eacute	"&#233;">
<!ENTITY ecirc	"&#234;">
<!ENTITY euml	"&#235;">

<!ENTITY igrave	"&#236;">
<!ENTITY iacute	"&#237;">
<!ENTITY icirc	"&#238;">
<!ENTITY iuml	"&#239;">
<!ENTITY ieth	"&#240;">

<!ENTITY ntilde	"&#241;">

<!ENTITY ograve	"&#242;">
<!ENTITY oacute	"&#243;">
<!ENTITY ocirc 	"&#244;">
<!ENTITY ozilde	"&#245;">
<!ENTITY ouml 	"&#246;">

<!ENTITY divide	"&#247;">

<!ENTITY oslash	"&#248;">

<!ENTITY ugrave	"&#249;">
<!ENTITY uacute	"&#250;">
<!ENTITY ucirc	"&#251;">
<!ENTITY uuml 	"&#252;">

<!ENTITY yacute	"&#253;">

<!ENTITY thorn	"&#254;">

<!ENTITY yuml	"&#255;">

